{
  "domains": {
    "D1": {
      "name": "General Security Concepts",
      "sections": [
        "S1",
        "S3"
      ],
      "weight": 0.12
    },
    "D2": {
      "name": "Threats, Vulnerabilities, and Mitigations",
      "sections": [
        "S13",
        "S2",
        "S8"
      ],
      "weight": 0.22
    },
    "D3": {
      "name": "Security Architecture",
      "sections": [
        "S5",
        "S6",
        "S7"
      ],
      "weight": 0.18
    },
    "D4": {
      "name": "Security Operations",
      "sections": [
        "S10",
        "S11",
        "S12",
        "S4",
        "S9"
      ],
      "weight": 0.28
    },
    "D5": {
      "name": "Security Program Management and Oversight",
      "sections": [
        "S14",
        "S15",
        "S16"
      ],
      "weight": 0.2
    }
  },
  "sections": {
    "S1": {
      "contentFile": "resources/source-content/section-01-summarize-fundamental-security-concepts.md",
      "domain": "D1",
      "originalFile": "external/source-repo/SYO-701+Study+Guide.pdf",
      "sourceSection": 1,
      "subsections": [
        {
          "id": "1.1",
          "title": "Introduction to Information Security"
        },
        {
          "id": "1.2",
          "title": "Cybersecurity Framework"
        },
        {
          "id": "1.3",
          "title": "Gap Analysis"
        },
        {
          "id": "1.4",
          "title": "Control Objectives"
        },
        {
          "id": "1.5",
          "title": "Security Control Categories"
        },
        {
          "id": "1.6",
          "title": "Security Control Functional Types"
        },
        {
          "id": "1.7",
          "title": "Security Roles & Responsibilities"
        }
      ],
      "title": "Summarize Fundamental Security Concepts"
    },
    "S10": {
      "contentFile": "resources/source-content/section-10-assess-endpoint-security-capabilities.md",
      "domain": "D4",
      "originalFile": "external/source-repo/SYO-701+Study+Guide.pdf",
      "sourceSection": 10,
      "subsections": [
        {
          "id": "10.1",
          "title": "Endpoint Security"
        },
        {
          "id": "10.2",
          "title": "Segmentation"
        },
        {
          "id": "10.3",
          "title": "Mobile Device Management"
        },
        {
          "id": "10.4",
          "title": "Secure Mobile Device Connections"
        }
      ],
      "title": "Assess Endpoint Security Capabilities"
    },
    "S11": {
      "contentFile": "resources/source-content/section-11-enhance-application-security-capabilities.md",
      "domain": "D4",
      "originalFile": "external/source-repo/SYO-701+Study+Guide.pdf",
      "sourceSection": 11,
      "subsections": [
        {
          "id": "11.1",
          "title": "DNS Security, Directory Services & SNMP"
        },
        {
          "id": "11.2",
          "title": "Secure Application Operations Protocols"
        },
        {
          "id": "11.3",
          "title": "File Transfer, Email & Video Services"
        },
        {
          "id": "11.4",
          "title": "Email Security"
        },
        {
          "id": "11.5",
          "title": "Secure Coding Techniques"
        }
      ],
      "title": "Enhance Application Security Capabilities"
    },
    "S12": {
      "contentFile": "resources/source-content/section-12-explain-incident-response-and-monitoring-concepts.md",
      "domain": "D4",
      "originalFile": "external/source-repo/SYO-701+Study+Guide.pdf",
      "sourceSection": 12,
      "subsections": [
        {
          "id": "12.1",
          "title": "Incident Response Process"
        },
        {
          "id": "12.2",
          "title": "Cyber Incident Response Team"
        },
        {
          "id": "12.3",
          "title": "Incident Response Plan"
        },
        {
          "id": "12.4",
          "title": "Incident Response Exercises, Recovery And Retention Policy"
        },
        {
          "id": "12.5",
          "title": "Incident Identification"
        },
        {
          "id": "12.6",
          "title": "Digital Forensics Documentation"
        },
        {
          "id": "12.7",
          "title": "Digital Forensics Evidence Acquisition"
        },
        {
          "id": "12.8",
          "title": "Data Sources"
        }
      ],
      "title": "Explain Incident Response and Monitoring Concepts"
    },
    "S13": {
      "contentFile": "resources/source-content/section-13-analyze-indicators-of-malicious-activity.md",
      "domain": "D2",
      "originalFile": "external/source-repo/SYO-701+Study+Guide.pdf",
      "sourceSection": 13,
      "subsections": [
        {
          "id": "13.1",
          "title": "Malware Classification"
        },
        {
          "id": "13.2",
          "title": "Computer Viruses"
        },
        {
          "id": "13.3",
          "title": "Computer Worms & Fileless Malware"
        },
        {
          "id": "13.4",
          "title": "Spyware, Keyloggers, Rootkits, Backdoors, Ransomware & Logic Bombs"
        },
        {
          "id": "13.5",
          "title": "Malware Indicators & Process Analysis"
        },
        {
          "id": "13.6",
          "title": "Password Attacks"
        },
        {
          "id": "13.7",
          "title": "Tactics, Techniques & Procedures"
        },
        {
          "id": "13.8",
          "title": "Privilege Escalation & Error Handling"
        },
        {
          "id": "13.9",
          "title": "Uniform Resource Locator Analysis & Percent Encoding"
        },
        {
          "id": "13.10",
          "title": "API & Replay Attacks, CSRF, Clickjacking & SSL Strip Attacks"
        },
        {
          "id": "13.11",
          "title": "Injection Attacks"
        }
      ],
      "title": "Analyze Indicators of Malicious Activity"
    },
    "S14": {
      "contentFile": "resources/source-content/section-14-summarize-security-governance-concepts.md",
      "domain": "D5",
      "originalFile": "external/source-repo/SYO-701+Study+Guide.pdf",
      "sourceSection": 14,
      "subsections": [
        {
          "id": "14.1",
          "title": "Regulations, Standards & Legislation"
        },
        {
          "id": "14.2",
          "title": "ISO and Cloud Frameworks"
        },
        {
          "id": "14.3",
          "title": "Governance Structure"
        },
        {
          "id": "14.4",
          "title": "Governance Documents"
        },
        {
          "id": "14.5",
          "title": "Change Management"
        },
        {
          "id": "14.6",
          "title": "Configuration Management"
        },
        {
          "id": "14.7",
          "title": "Scripting, Automation & Orchestration"
        }
      ],
      "title": "Summarize Security Governance Concepts"
    },
    "S15": {
      "contentFile": "resources/source-content/section-15-explain-risk-management.md",
      "domain": "D5",
      "originalFile": "external/source-repo/SYO-701+Study+Guide.pdf",
      "sourceSection": 15,
      "subsections": [
        {
          "id": "15.1",
          "title": "Risk Management Process"
        },
        {
          "id": "15.2",
          "title": "Risk Controls"
        },
        {
          "id": "15.3",
          "title": "Business Impact Analysis"
        },
        {
          "id": "15.4",
          "title": "Third-Party Risk Management & Security Agreements"
        },
        {
          "id": "15.5",
          "title": "Audit & Assurance"
        },
        {
          "id": "15.6",
          "title": "PenTest Attack Life Cycle"
        }
      ],
      "title": "Explain Risk Management"
    },
    "S16": {
      "contentFile": "resources/source-content/section-16-summarize-data-protection-and-compliance-concepts.md",
      "domain": "D5",
      "originalFile": "external/source-repo/SYO-701+Study+Guide.pdf",
      "sourceSection": 16,
      "subsections": [
        {
          "id": "16.1",
          "title": "Privacy & Sensitive Data Concepts"
        },
        {
          "id": "16.2",
          "title": "Data Sovereignty, Privacy Breaches & Data Sharing"
        },
        {
          "id": "16.3",
          "title": "Privacy And Data Controls"
        },
        {
          "id": "16.4",
          "title": "Privacy Principles"
        },
        {
          "id": "16.5",
          "title": "Compliance Monitoring"
        },
        {
          "id": "16.6",
          "title": "Education, Training & Awareness"
        },
        {
          "id": "16.7",
          "title": "Personnel Policies"
        }
      ],
      "title": "Summarize Data Protection and Compliance Concepts"
    },
    "S2": {
      "contentFile": "resources/source-content/section-02-explaining-threat-actors-and-threat-vectors.md",
      "domain": "D2",
      "originalFile": "external/source-repo/SYO-701+Study+Guide.pdf",
      "sourceSection": 2,
      "subsections": [
        {
          "id": "2.1",
          "title": "Vulnerability, Threat And Risk"
        },
        {
          "id": "2.2",
          "title": "Attributes Of Threat Actors"
        },
        {
          "id": "2.3",
          "title": "Threat Actors"
        },
        {
          "id": "2.4",
          "title": "Attack Surface & Attack Vectors"
        },
        {
          "id": "2.5",
          "title": "Vulnerable Software & Network Vectors"
        },
        {
          "id": "2.6",
          "title": "Lure-Based & Message-Based Vectors"
        },
        {
          "id": "2.7",
          "title": "Third Party Risks"
        },
        {
          "id": "2.8",
          "title": "Intro To Social Engineering"
        }
      ],
      "title": "Explaining Threat Actors And Threat Vectors"
    },
    "S3": {
      "contentFile": "resources/source-content/section-03-explain-cryptographic-solutions.md",
      "domain": "D1",